{
  "apiVersion": "compliance.example/v1",
  "kind": "Control",
  "metadata": {
    "id": "organization.assertion.required",
    "version": 1
  },
  "spec": {
    "title": "Required organizational assertions are supported",
    "purpose": "Verify that a required organizational condition is supported by qualifying attributable evidence.",
    "entrypoint": "data.compliance.controls.organization_assertion_required.evaluate",
    "applies_to": [
      "entity"
    ],
    "evidence": [
      {
        "id": "assertion",
        "type": "organization.assertion/v1",
        "inputs_schema": {
          "type": "object",
          "required": [
            "scheme"
          ],
          "additionalProperties": false,
          "properties": {
            "scheme": {
              "type": "string",
              "minLength": 1
            }
          },
          "$id": "https://compliance.example/schemas/controls/organization.assertion.required/evidence/assertion/inputs/v1.schema.json"
        }
      }
    ],
    "parameters_schema": "parameters.schema.json",
    "defaults": {
      "severity": "high",
      "remediation": "Obtain a qualifying attributable observation for the exact policy dependency."
    }
  }
}
