{
  "apiVersion": "compliance.example/v1",
  "kind": "Control",
  "metadata": {
    "id": "macos.homebrew.formulae-required",
    "version": 1
  },
  "spec": {
    "title": "Required Homebrew formulae are installed",
    "purpose": "Verify that the Homebrew formulae mandated by policy are present.",
    "entrypoint": "data.compliance.controls.macos.homebrew_formulae_required.evaluate",
    "applies_to": [
      "macos-workstation"
    ],
    "evidence": [
      {
        "type": "macos.homebrew/v1",
        "id": "observation"
      }
    ],
    "parameters_schema": "parameters.schema.json",
    "defaults": {
      "severity": "medium",
      "remediation": "Install missing formulae from the approved Homebrew source."
    }
  }
}
