{
  "apiVersion": "compliance.example/v1",
  "kind": "Control",
  "metadata": {
    "id": "saas.tenant.setting_equals",
    "version": 1
  },
  "spec": {
    "title": "SaaS tenant settings match policy",
    "purpose": "Verify that SaaS tenant security settings have the effective values mandated by policy.",
    "entrypoint": "data.compliance.controls.saas.tenant_setting_equals.evaluate",
    "applies_to": [
      "saas-tenant"
    ],
    "evidence": [
      {
        "type": "saas.tenant.configuration/v1",
        "id": "observation"
      }
    ],
    "parameters_schema": "parameters.schema.json",
    "defaults": {
      "severity": "high",
      "remediation": "Apply the approved SaaS tenant security configuration."
    }
  }
}
