{
  "apiVersion": "compliance.example/v1",
  "kind": "Control",
  "metadata": {
    "id": "macos.security.setting_equals",
    "version": 1
  },
  "spec": {
    "title": "macOS security settings match policy",
    "purpose": "Verify that macOS security settings have the effective values mandated by policy.",
    "entrypoint": "data.compliance.controls.macos.security_setting_equals.evaluate",
    "applies_to": [
      "macos-workstation"
    ],
    "evidence": [
      {
        "type": "macos.security/v1",
        "id": "observation"
      }
    ],
    "parameters_schema": "parameters.schema.json",
    "defaults": {
      "severity": "high",
      "remediation": "Apply the approved macOS security configuration."
    }
  }
}
