{
  "apiVersion": "compliance.example/v1",
  "kind": "Control",
  "metadata": {
    "id": "aws.account.number-at-least",
    "version": 1
  },
  "spec": {
    "title": "AWS account settings meet approved minimums",
    "purpose": "Verify that numeric AWS account settings meet the minimum values mandated by policy.",
    "entrypoint": "data.compliance.controls.aws.account_number_at_least.evaluate",
    "applies_to": [
      "aws-account"
    ],
    "evidence": [
      {
        "type": "aws.account.configuration/v1",
        "id": "observation"
      }
    ],
    "parameters_schema": "parameters.schema.json",
    "defaults": {
      "severity": "medium",
      "remediation": "Raise the AWS account setting to the approved minimum."
    }
  }
}
